{
  "institution_id": "legacy-416",
  "database_id": 416,
  "name": "Banaras Hindu University - Faculty of Education",
  "website": "https://www.bhu.ac.in",
  "outcome": "classified",
  "institution_type": "central_university",
  "source_url": "https://www.bhu.ac.in/Site/Page/1_2_32_65_Main-Site-About-BHU",
  "confidence": "high",
  "evidence": "BHU's official About BHU page describes its main campus as a \"premier Central University\" and states that the university comprises 14 Faculties.",
  "notes": [
    "The official Faculty of Education page identifies the assigned unit as a faculty within Banaras Hindu University: https://www.bhu.ac.in/Site/Page/1_136_138_Faculty-of-Education-About",
    "Normal TLS verification returned the exact self-signed certificate-chain error; curl --insecure was used for public reads on the official hostname."
  ]
}
