{
  "institution_id": "legacy-299",
  "database_id": 299,
  "name": "National Institute of Sports Patiala",
  "website": "https://nsiindia.gov.in",
  "outcome": "manual_review",
  "institution_type": null,
  "source_url": null,
  "confidence": null,
  "evidence": null,
  "notes": [
    "The supplied domain identifies National Savings Institute under the Ministry of Finance, Government of India, not National Institute of Sports Patiala; the assigned website therefore cannot establish the institute type.",
    "Normal TLS verification failed with the managed proxy certificate-chain error; curl --insecure was used for public GET requests to the expected official hostname."
  ]
}
