{
  "institution_id": "legacy-140",
  "database_id": 140,
  "name": "Marine Engineering and Research Institute (MERI)",
  "website": "https://www.merikolkata.ac.in",
  "outcome": "manual_review",
  "institution_type": null,
  "source_url": null,
  "confidence": null,
  "evidence": null,
  "notes": [
    "Could not verify the supplied official website: normal HTTPS requests to www.merikolkata.ac.in and merikolkata.ac.in failed because public DNS returned NXDOMAIN. No --insecure fallback was used because this was not a proxy certificate-chain error."
  ]
}
