{
  "institution_id": "legacy-430",
  "database_id": 430,
  "name": "Target Defence Academy",
  "website": "https://www.targetdefenceacademy.com",
  "outcome": "classified",
  "institution_type": "specialized",
  "source_url": "https://www.targetdefenceacademy.com/introduction",
  "confidence": "high",
  "evidence": "The official Introduction page identifies Target Defence Academy as an NDA coaching institute and coaching centre in Lucknow providing defence-exam training.",
  "notes": [
    "Normal TLS verification returned a self-signed certificate in certificate chain error; public GETs were retried with curl --insecure."
  ]
}
