{
  "institution_id": "legacy-383",
  "database_id": 383,
  "name": "Pune Institute of Business Management",
  "website": "https://www.pibm.in",
  "outcome": "classified",
  "institution_type": "specialized",
  "source_url": "https://www.pibm.in/about-pibm.html",
  "confidence": "high",
  "evidence": "The official About PIBM page identifies Pune Institute of Business Management as a B-School focused on postgraduate management education, offering an AICTE-approved PGDM and an SPPU-affiliated MBA.",
  "notes": [
    "Normal TLS verification failed with the managed proxy's self-signed certificate-chain error; public GET fallback used curl --insecure for the official hostname."
  ]
}
