{
  "institution_id": "legacy-110",
  "database_id": 110,
  "name": "Sir JJ College of Architecture",
  "website": "https://www.sirjjarchitecture.org",
  "outcome": "manual_review",
  "institution_type": null,
  "source_url": null,
  "confidence": null,
  "evidence": null,
  "notes": [
    "Normal TLS verification failed with a self-signed certificate in the certificate chain; curl --insecure fallback was attempted as permitted but HTTPS handshakes failed.",
    "The official hostname returned a generic 404 page over HTTP, so the institution identity and institutional type could not be established from an official page."
  ]
}
