{
  "institution_id": "legacy-266",
  "database_id": 266,
  "name": "IIT Bombay (Electrical)",
  "website": "https://www.iitb.ac.in",
  "outcome": "classified",
  "institution_type": "iit",
  "source_url": "https://www.iitb.ac.in/institute-vision-mission",
  "confidence": "high",
  "evidence": "The official Institute Vision & Mission page identifies IIT Bombay as an “Institute of National Importance established by an Act of Parliament,” supporting the IIT classification.",
  "notes": [
    "The official page title identifies the organization as भारतीय प्रौद्योगिकी संस्थान मुंबई (IIT Bombay), confirming the supplied website.",
    "Normal TLS verification failed with the managed proxy's self-signed certificate-chain error; public GETs used curl --insecure as permitted."
  ]
}
