{
  "institution_id": "legacy-419",
  "database_id": 419,
  "name": "Amity Institute of Psychology and Allied Sciences",
  "website": "https://www.amity.edu",
  "outcome": "classified",
  "institution_type": "specialized",
  "source_url": "https://www.amity.edu/noida/aips/about",
  "confidence": "high",
  "evidence": "The official AIPS About Us page identifies the institute as offering UG, PG, dual, and PhD programs across applied, counselling, organisational, clinical, child and adolescent psychology, and behavioural sciences.",
  "notes": [
    "Used curl --insecure after normal TLS failed with the managed proxy's self-signed certificate in the certificate chain."
  ]
}
