{
  "institution_id": "legacy-358",
  "database_id": 358,
  "name": "IIT Bombay (Chemical)",
  "website": "https://www.iitb.ac.in",
  "outcome": "classified",
  "institution_type": "iit",
  "source_url": "https://www.iitb.ac.in/about",
  "confidence": "high",
  "evidence": "IIT Bombay's official About page identifies it as an autonomous institute and deemed university, and states that an Act of Parliament granted it institution-of-national-importance status under the Institutes of Technology Act.",
  "notes": [
    "Normal TLS verification failed due to a self-signed certificate in the proxy chain; used curl --insecure only for public GET requests to the expected official hostname."
  ]
}
