{
  "institution_id": "legacy-105",
  "database_id": 105,
  "name": "Srishti Manipal Institute of Art Design and Technology",
  "website": "https://srishti.ac.in",
  "outcome": "manual_review",
  "institution_type": null,
  "source_url": null,
  "confidence": null,
  "evidence": null,
  "notes": [
    "Normal TLS failed with the permitted self-signed certificate-in-chain proxy error; retried the public GET with curl --insecure.",
    "The supplied domain returned only “Welcome to Srishti” and did not identify the named institute or establish an institutional or legal type."
  ]
}
