{
  "institution_id": "legacy-367",
  "database_id": 367,
  "name": "Government Polytechnic Mumbai",
  "website": "https://gpmumbai.ac.in",
  "outcome": "classified",
  "institution_type": "government_college",
  "source_url": "https://gpmumbai.ac.in/gpmweb/the-institute/about-us/",
  "confidence": "high",
  "evidence": "The official About Us page identifies Government Polytechnic Mumbai as an academically autonomous institute of the Government of Maharashtra and describes its AICTE-approved diploma programmes.",
  "notes": [
    "Normal TLS verification encountered the managed proxy self-signed certificate-chain error; the public official page was retrieved with curl --insecure as permitted."
  ]
}
