{
  "institution_id": "legacy-62",
  "database_id": 62,
  "name": "Amity University (Actuarial Science)",
  "website": "https://www.amity.edu",
  "outcome": "classified",
  "institution_type": "private_university",
  "source_url": "https://www.amity.edu/about-university.aspx",
  "confidence": "high",
  "evidence": "The official About Amity University page calls it a “Private University” and states that it was established by an Act of the State Legislature and is recognized by the UGC.",
  "notes": [
    "Normal TLS verification failed with the exact proxy certificate error “self signed certificate in certificate chain”; curl --insecure was then used only for public GET requests to www.amity.edu."
  ]
}
