{
  "institution_id": "legacy-8",
  "database_id": 8,
  "name": "CMI Chennai",
  "website": "https://www.cmi.ac.in",
  "outcome": "classified",
  "institution_type": "deemed_university",
  "source_url": "https://www.cmi.ac.in/RTI/CMI_RTI.pdf",
  "confidence": "high",
  "evidence": "The official RTI document identifies Chennai Mathematical Institute as “a University under Section 3 of the UGC Act, 1956,” establishing its deemed-university status.",
  "notes": [
    "The official homepage identifies the institute as Chennai Mathematical Institute, confirming the supplied website belongs to CMI Chennai.",
    "Normal TLS verification failed with the managed proxy self-signed certificate-chain error; curl --insecure was used only for public GET requests to www.cmi.ac.in."
  ]
}
