{
  "institution_id": "legacy-256",
  "database_id": 256,
  "name": "Berhampur University (Marine Science)",
  "website": "https://www.buodisha.edu.in",
  "outcome": "classified",
  "institution_type": "state_university",
  "source_url": "https://buodisha.edu.in/the-university/",
  "confidence": "high",
  "evidence": "The official About the University page states that Berhampur University was established by the Odisha Act 21 of 1966 as an affiliating university, supporting classification as a state university.",
  "notes": [
    "The official Marine Sciences page identifies Marine Sciences as a department of Berhampur University.",
    "Normal TLS verification failed with a self-signed certificate in the certificate chain; curl --insecure was used for public GET requests as permitted."
  ]
}
