{
  "institution_id": "legacy-83",
  "database_id": 83,
  "name": "Faculty of Management Studies (FMS), University of Delhi",
  "website": "https://fms.edu",
  "outcome": "classified",
  "institution_type": "specialized",
  "source_url": "https://www.fms.edu/about",
  "confidence": "high",
  "evidence": "The official About page describes FMS as an institution dedicated to management education and states it was established under the aegis of the University of Delhi, identifying it as a specialized management institution.",
  "notes": [
    "Normal TLS failed with the managed proxy's self-signed certificate-chain error; public GET was retried with curl --insecure."
  ]
}
