{
  "institution_id": "legacy-223",
  "database_id": 223,
  "name": "Government Law College Mumbai",
  "website": "https://glcmumbai.ac.in",
  "outcome": "manual_review",
  "institution_type": null,
  "source_url": null,
  "confidence": null,
  "evidence": null,
  "notes": [
    "The supplied official domain could not be accessed: normal-TLS HTTPS requests failed because glcmumbai.ac.in could not be resolved, and public DNS-over-HTTPS returned NXDOMAIN.",
    "The --insecure fallback was not used because no proxy certificate error occurred."
  ]
}
