{
  "institution_id": "legacy-131",
  "database_id": 131,
  "name": "Amity University",
  "website": "https://www.amity.edu",
  "outcome": "classified",
  "institution_type": "private_university",
  "source_url": "https://www.amity.edu/about-university.aspx",
  "confidence": "high",
  "evidence": "The official About Amity page identifies it as a \"Private University\" and states that Amity University was established by an Act of the State Legislature and is recognized by the UGC.",
  "notes": [
    "Normal TLS verification failed with a self-signed certificate in the proxy chain; used curl --insecure for public GETs to www.amity.edu."
  ]
}
