{
  "institution_id": "legacy-205",
  "database_id": 205,
  "name": "SPA Vijayawada",
  "website": "https://www.spavijayawada.ac.in",
  "outcome": "manual_review",
  "institution_type": null,
  "source_url": null,
  "confidence": null,
  "evidence": null,
  "notes": [
    "The supplied official hostname did not resolve via command-line HTTPS; public DNS returned NXDOMAIN for both the apex and www hostnames, so the institute type could not be verified from the official site."
  ]
}
