{
  "institution_id": "legacy-198",
  "database_id": 198,
  "name": "State Bank Institute of Learning and Development",
  "website": "https://www.sbild.in",
  "outcome": "manual_review",
  "institution_type": null,
  "source_url": null,
  "confidence": null,
  "evidence": null,
  "notes": [
    "The supplied hostname and apex domain return DNS NXDOMAIN, so no official page could be retrieved to establish the institution's type; insecure TLS fallback was not used because no certificate error occurred."
  ]
}
