{
  "institution_id": "legacy-414",
  "database_id": 414,
  "name": "Jamia Millia Islamia - Department of Educational Studies",
  "website": "https://www.jmi.ac.in",
  "outcome": "classified",
  "institution_type": "central_university",
  "source_url": "https://www.jmi.ac.in/About-Jamia/Profile/About-JMI",
  "confidence": "high",
  "evidence": "The official About JMI page identifies Jamia Millia Islamia as a “Public Central University” and states that it became a Central University by an Act of Parliament in 1988.",
  "notes": [
    "The official Department of Educational Studies page is hosted on the same jmi.ac.in domain: https://www.jmi.ac.in/educationalstudies.",
    "Normal TLS verification failed with a self-signed certificate in the proxy chain; public GET requests were retrieved using curl --insecure as permitted."
  ]
}
